Source,Date,Title,Headline
Fox News,2021-09-28,Coexisting With COVID Moving Forward ft Dr Danielle Scheurer,This week Trey sits down with Chief Quality Officer Professor at the Medical University of South Carolina Dr Danielle Scheurer
Fox News,2021-10-06,Rep Byron Donalds R FL Criticizes Biden s Russian Roulette Comments He s Gaslighting America,On Fox Across America with Jimmy Failla Rep Byron Donalds R FL reacted to President Biden s comments about Republicans playing Russian Roulette with the American economy over the debt ceiling Oh Lord give me a break First of all his little cute li
Fox News,2021-10-07,Bill Melugin Suspected Cartel Members Wield AK s Near Border Taunt Texas National Guard,Listen To The Full Interview Below Bill Melugin Fox News National correspondent joined the Guy Benson Show from the southern border to report on suspected cartel members who were seen wielding AK s near the southern border and taunting Texas national guar
Fox News,2021-10-06,Susana Martinez Never In My Life Have I Seen Absolute Total Incompetence At The Border,Susana Martinez former Governor of New Mexico tells Brian Kilmeade never in my life have I ever seen absolute and total incompetence handling the Southern border Martinez says this is a dereliction of duty by the President and the Vice President to the peo
Fox News,2021-10-07,The Impact Of FOX News Years Later,On October th the Fox News Channel launched as a newcomer to the cable news industry and years later it has become the number one highest rated network in the industry Co host of Fox and Friends and host of The Brian Kilmeade Show Brian Kilmea
Fox News,2021-10-08,Comedy Is About Not Being Afraid Kat Timpf On Backlash Over Dave Chappelle s New Netflix Special,Listen To The Full Interview Kat Timpf Fox News Contributor and Co Host of Gutfeld joined the Guy Benson Show to react to the backlash that comedian Dave Chappelle is facing from critics over jokes he made in his newest Netflix special Timpf reacted to th
Fox News,2021-10-08,Dagen McDowell Reacts To Horrible September Jobs Report,Listen To The Full Interview Below Dagen McDowell anchor and analyst on the Fox Business Network and a business correspondent for the Fox News Channel joined the Guy Benson Show to react to September s jobs report that misses expiations only creating
Fox News,2021-10-08,Max Lucado You Were Made For This Moment,This week Shannon sits down with New York Times Bestselling Author and Pastor Max Lucado to discuss his new book Listen now
Fox News,2021-09-08,General David Petraeus Ret We Are In A Better Position Relative To Islamist Extremists Now Than We Were The Day Before,General David Petraeus Ret former Commander of US Int l Forces in Afghanistan spoke to Brian Kilmeade about the th anniversary of the September terror attacks Petraeus discussed how he was deployed in Bosnia at the time of the attacks and sa
Fox News,2021-09-10,Lisa Boothe Biden s Forcing Millions Into Getting A Vaccine They Don t Want,On Fox Across America with Jimmy Failla Fox News Contributor Lisa Boothe talks about President Biden s plan to get more people vaccinated in the workplace You ve got a president that couldn t care less about the Constitution couldn t care less about Ameri
Fox News,2021-09-22,Rep Brad Wenstrup From The Army To Congress What It Means To Serve,On this episode Jason discusses the crisis at the U S Mexico border as well as a look at the possible defunding of the Minneapolis Police Department Then he brings on the stupid with a look at how the USAID is spending taxpayer dollars in Afghanistan wit
Fox News,2021-09-14,The Inside Story of Tracking Down Usama Bin Laden w Chris Wallace,Anchor of FOX News Sunday Chris Wallace sits down with Trey Gowdy to discuss his new book Countdown bin Laden Listen now
Fox News,2021-09-14,Harris Faulkner On The Importance Of First Responders,On Fox Across America with Jimmy Failla Anchor of The Faulkner Focus and Outnumbered Co Host Harris Faulkner discussed her new Fox Nation show When Seconds Count which focuses on the brave actions of first responders so of which go uncelebrated each
Fox News,2021-09-15,Tyrus I Don t Have A Lot Of Optimism About Gavin Newsom,On Fox Across America with Jimmy Failla Tyrus from Fox Nation and Gutfeld gave his take the morning after California Governor Gavin Newsom survived a recall election challenge from Larry Elder and the Republican Party I don t have a lot of optimism when
Fox News,2021-09-16,Arizona AG Mark Brnovich Biden s Vaccine Employer Rules Are Constitutionally Suspect,On Fox Across America with Jimmy Failla Arizona Attorney General Mark Brnovich explains why he is suing the Biden Administration over their employer vaccination play because its based on a premise that constitutionally suspect I think what it does is poi
Fox News,2021-09-10,Evening Edition Remembering With Acts Of Kindness And Good Deeds,The September National Day of Service and Remembrance or Day is a federally recognized National Day of Service established in Day looks to transform the tragic anniversary of the terror attacks into a day of individuals and groups doi
Fox News,2021-09-10,Amy Argetsinger The Secret History Of Miss America,This week Shannon sits down with Editor for the Style section of The Washington Post Amy Argetsinger to discuss her new book There She Was The Secret History of Miss America
Fox News,2021-09-09,Rep Ronny Jackson R TX Fauci Is Potentially The Guy That Created The Coronavirus,On Fox Across America with Jimmy Failla Rep Ronny Jackson R TX talks about why he thinks Dr Fauci needs to be investigated for his role in the development of the coronavirus We shouldn t be taking advice from this guy at this point we should be invest
Fox News,2021-09-09,David Rubenstein Regaining Faith In The American Dream,This week Dana is joined by co founder and co executive chairman of private equity firm The Carlyle Group and New York Times Bestselling Author David Rubenstein
