Source,Date,Title,Headline
MacRumors,2021-09-17,Apple Online Store Down Ahead of iPhone and Pro Pre Orders,Apple s online store is down ahead of iPhone mini iPhone iPhone Pro and iPhone Pro Max pre orders which are set to begin at a m Pacific Time in the United States You re early reads the Apple Store message when attempting
MacRumors,2021-09-15,Redesigned iPad Mini Has Increased GB of RAM iPad Remains at GB,Apple this week introduced a redesigned sixth generation iPad mini that looks much closer to the current iPad Air with slimmer bezels a Touch ID power button a USB C port compatibility with the second generation Apple Pencil and more The new iPad m
MacRumors,2021-09-13,Here s How Apple Strategically Places Its Products In Apple TV Shows,Apple TV is Apple s streaming service written produced and developed by Apple and its partners so it shouldn t come as a surprise for anyone to learn that Apple products are commonly placed throughout scenes for Apple TV shows but they re all done fo
MacRumors,2021-09-14,Apple Announces New th Gen iPad With A Chip True Tone Display and More,Apple today announced a new ninth generation iPad at its California Streaming event which features an A Bionic chip offering up to faster performance a True Tone display an upgraded front camera and more More to follow Tag September
MacRumors,2021-09-14,TrendForce Shares Last Minute iPhone Expectations Ahead of Today s Apple Event,Apple will be holding a virtual event today at a m Pacific Time and ahead of time Taiwanese research firm TrendForce has outlined its last minute expectations for iPhone features and production of the devices In line with previously rumored fea
MacRumors,2021-09-14,Samsung Takes Jab at Apple After Finally Including ProMotion Displays in iPhone Pro,Following the launch of the iPhone Pro and iPhone Pro Max earlier today which features ProMotion displays with a variable Hz refresh rate Samsung has come out in an apparent jab to Apple for being late to join the wider industry in adopting highe
MacRumors,2021-09-14,Next Emojis Will Include Melting Face Biting Lip Heart Hands Troll and More,The Unicode Consortium today released the list of new emojis that are coming in the Emoji update giving us a look at the new characters that we can expect to see introduced on Apple devices later this year As outlined by Emojipedia the finalized li
MacRumors,2021-09-20,iMovie and Clips Apps for iOS Gain Support for iPhone Features,Apple today updated iMovie and Clips with support for several new features that are set to be introduced alongside the iPhone models iMovie now supports Cinematic Mode and can be used to add adjust and delete focus points and modify the depth of
MacRumors,2021-09-20,Apple Prompts Pre Order Customers to Get Ready for New iPhone With iCloud Syncing and Trade Ins,iPhone users who have pre ordered an iPhone model are seeing a new prompt in the Settings app that walks through the steps of preparing for a new device Tapping on this prompt encourages users to make sure that iCloud syncing is enabled for all of th
MacRumors,2021-09-20,Ted Lasso Makes History as First Streaming Service Show With Emmy Win For Outstanding Comedy Series,The popular Apple TV comedy series Ted Lasso has been awarded four new Emmy awards making history for Apple TV as it became the first streaming service to win an Emmy award in a program category in only its second year of eligibility Ted Lasso has won
MacRumors,2021-09-21,Apple Researching Ways to Use iPhone Camera to Detect Childhood Autism,Apple is reportedly researching ways to use the cameras inside of the iPhone to detect childhood autism aiming to use data from the camera to observe a child s behavior that could be used for early diagnosis according to a new report from The Wall Street Jo
MacRumors,2021-09-10,Apple Obsoletes GB Fifth Generation iPod touch,Apple today added the GB fifth generation iPod touch released in to its list of obsolete products This specific variation of the iPod touch was released as a lower end option to the fifth generation iPod touch released a year earlier Compa
MacRumors,2021-09-09,Deals Get Up to Off Anker s Top Charging Accessories in Today s Gold Box Sale,Anker today opened up a new Gold Box sale on Amazon taking up to percent off select charging accessories for one day only This includes portable chargers car chargers wireless chargers USB C cables and more Note MacRumors is an affiliate partner
MacRumors,2021-09-14,Rumor Suggests Low Cost Ninth Generation iPad to Debut at Apple Event Later Today,A new rumor suggests that Apple may debut its updated baseline ninth generation iPad later today as part of several new product announcements for its California streaming event According to the Weibo account PandaIsBald who has shared information r
MacRumors,2021-09-22,How to Disable Tab Bar Coloring in Safari on macOS,Safari for macOS Big Sur and macOS Catalina introduces support for several features that will be native to the upcoming macOS Monterey update including some interface design changes that haven t been universally welcomed Fortunately Apple has made some
MacRumors,2021-09-24,Everything New in the iOS Apple Podcasts App,The Podcasts app gets a number of improvements in Apple s recently released iOS and iPadOS updates including the new systemwide Shared with You feature personalized recommendations new keyboard shortcuts and more This guide walks through all
MacRumors,2021-09-24,iPhone Pro Max Gets Nearly Hours of Battery Life in Continuous Usage Test,Arun Maini today shared a new iPhone battery life test on his YouTube channel Mrwhosetheboss timing how long all four iPhone models last on a single charge compared to older iPhone models Maini said all of the iPhones had battery health and were set
MacRumors,2021-09-24,iPhone Users Experiencing Unable to Communicate with Apple Watch Bug With Mask Unlocking,Several iPhone users have taken to online forums and social media to report that after receiving their brand new iPhones they re experiencing a bug preventing it from communicating with their Apple Watch making what s supposed to be a seamless experience
MacRumors,2021-10-04,MacRumors Giveaway Win an Apple Themed T Shirt From Throwboy,We ve teamed up with Throwboy to offer MacRumors readers a chance to win an Apple themed T Shirt Throwboy is well known for its pillows that look like classic Apple products but the company also has a popular line of T shirts that feature designs immediatel
MacRumors,2021-10-05,Apple Agrees to Pay Million to Settle Lawsuit Claiming Refurbished Devices Aren t Equivalent to New,Apple on Friday reached a million settlement that pending court approval will resolve a class action lawsuit that accused the company of violating the Magnuson Moss Warranty Act and other U S laws by providing customers with refurbished replacement dev
MacRumors,2021-10-05,Apple Commemorates th Anniversary of Steve Jobs Passing,Apple today celebrates the tenth anniversary of Steve Jobs passing with a special commemorative homepage on its website including pictures and a link to a short film that captures some of his most memorable quotes and moments at Apple s helm The homep
MacRumors,2021-09-30,Apple Seeds macOS Big Sur Beta to Developers With Security Fixes,Apple today seeded a macOS Big Sur beta to developers for testing purposes with the update coming two weeks after the launch of macOS Big Sur Registered developers can download the beta through the Apple Developer Center and once the approp
MacRumors,2021-10-01,MacRumors Giveaway Win a Flight Bag Leather Briefcase and Accessories From Saddleback Leather Co,We ve teamed up with Saddleback Leather Co to offer MacRumors readers a chance to win a prize pack that includes a Flight Bag Leather Briefcase a Leather AirPods Pro Case a Double Loop AirTag Holder and a Square Sleeve AirTag Holder all made from a rich
MacRumors,2021-09-27,Google Criticizes EU Regulators for Ignoring Apple in Bid to Get Billion Antitrust Fine Annulled,Google today lambasted European Union regulators for ignoring Apple and the rivalry between Apple and Android in the antitrust accusations that have been levied against Google reports Reuters Apple was brought up as part of Google s attempt to get a ma
